{
  "schema_version": "physical-ai-gen3-paired-statistics-v1",
  "pass": true,
  "denominator": {
    "paired_keys": 60,
    "suites": [
      "libero_spatial",
      "libero_object",
      "libero_goal"
    ],
    "task_groups": 12,
    "source_sha256": "c9a97421d37b3341ae17d6da57af4e7994ce3b669794a5f16efce52d5f4c5b0a"
  },
  "overall": {
    "denominator": 60,
    "openvla_successes": 35,
    "pi05_successes": 58,
    "difference_successes": 23,
    "openvla_success_rate": 0.5833333333333334,
    "pi05_success_rate": 0.9666666666666667,
    "difference_rate": 0.38333333333333336
  },
  "paired_difference": {
    "direction": "pi05-libero minus openvla-libero",
    "success_numerator": 23,
    "denominator": 60,
    "rate": 0.38333333333333336,
    "bootstrap_95": {
      "method": "paired-nonparametric-bootstrap-percentile-type7",
      "confidence": 0.95,
      "seed": 20260721,
      "resamples": 10000,
      "lower": 0.25,
      "upper": 0.5166666666666667
    }
  },
  "contingency": {
    "both_success": 34,
    "pi05_only_success": 24,
    "openvla_only_success": 1,
    "both_non_success": 1
  },
  "suites": [
    {
      "suite": "libero_goal",
      "denominator": 20,
      "openvla_successes": 10,
      "pi05_successes": 18,
      "difference_successes": 8,
      "openvla_success_rate": 0.5,
      "pi05_success_rate": 0.9,
      "difference_rate": 0.4
    },
    {
      "suite": "libero_object",
      "denominator": 20,
      "openvla_successes": 12,
      "pi05_successes": 20,
      "difference_successes": 8,
      "openvla_success_rate": 0.6,
      "pi05_success_rate": 1.0,
      "difference_rate": 0.4
    },
    {
      "suite": "libero_spatial",
      "denominator": 20,
      "openvla_successes": 13,
      "pi05_successes": 20,
      "difference_successes": 7,
      "openvla_success_rate": 0.65,
      "pi05_success_rate": 1.0,
      "difference_rate": 0.35
    }
  ],
  "tasks": [
    {
      "suite": "libero_goal",
      "task_id": 0,
      "denominator": 5,
      "openvla_successes": 2,
      "pi05_successes": 5,
      "difference_successes": 3,
      "openvla_success_rate": 0.4,
      "pi05_success_rate": 1.0,
      "difference_rate": 0.6
    },
    {
      "suite": "libero_goal",
      "task_id": 3,
      "denominator": 5,
      "openvla_successes": 2,
      "pi05_successes": 3,
      "difference_successes": 1,
      "openvla_success_rate": 0.4,
      "pi05_success_rate": 0.6,
      "difference_rate": 0.2
    },
    {
      "suite": "libero_goal",
      "task_id": 6,
      "denominator": 5,
      "openvla_successes": 3,
      "pi05_successes": 5,
      "difference_successes": 2,
      "openvla_success_rate": 0.6,
      "pi05_success_rate": 1.0,
      "difference_rate": 0.4
    },
    {
      "suite": "libero_goal",
      "task_id": 9,
      "denominator": 5,
      "openvla_successes": 3,
      "pi05_successes": 5,
      "difference_successes": 2,
      "openvla_success_rate": 0.6,
      "pi05_success_rate": 1.0,
      "difference_rate": 0.4
    },
    {
      "suite": "libero_object",
      "task_id": 0,
      "denominator": 5,
      "openvla_successes": 4,
      "pi05_successes": 5,
      "difference_successes": 1,
      "openvla_success_rate": 0.8,
      "pi05_success_rate": 1.0,
      "difference_rate": 0.2
    },
    {
      "suite": "libero_object",
      "task_id": 3,
      "denominator": 5,
      "openvla_successes": 2,
      "pi05_successes": 5,
      "difference_successes": 3,
      "openvla_success_rate": 0.4,
      "pi05_success_rate": 1.0,
      "difference_rate": 0.6
    },
    {
      "suite": "libero_object",
      "task_id": 6,
      "denominator": 5,
      "openvla_successes": 3,
      "pi05_successes": 5,
      "difference_successes": 2,
      "openvla_success_rate": 0.6,
      "pi05_success_rate": 1.0,
      "difference_rate": 0.4
    },
    {
      "suite": "libero_object",
      "task_id": 9,
      "denominator": 5,
      "openvla_successes": 3,
      "pi05_successes": 5,
      "difference_successes": 2,
      "openvla_success_rate": 0.6,
      "pi05_success_rate": 1.0,
      "difference_rate": 0.4
    },
    {
      "suite": "libero_spatial",
      "task_id": 0,
      "denominator": 5,
      "openvla_successes": 5,
      "pi05_successes": 5,
      "difference_successes": 0,
      "openvla_success_rate": 1.0,
      "pi05_success_rate": 1.0,
      "difference_rate": 0.0
    },
    {
      "suite": "libero_spatial",
      "task_id": 3,
      "denominator": 5,
      "openvla_successes": 4,
      "pi05_successes": 5,
      "difference_successes": 1,
      "openvla_success_rate": 0.8,
      "pi05_success_rate": 1.0,
      "difference_rate": 0.2
    },
    {
      "suite": "libero_spatial",
      "task_id": 5,
      "denominator": 5,
      "openvla_successes": 2,
      "pi05_successes": 5,
      "difference_successes": 3,
      "openvla_success_rate": 0.4,
      "pi05_success_rate": 1.0,
      "difference_rate": 0.6
    },
    {
      "suite": "libero_spatial",
      "task_id": 8,
      "denominator": 5,
      "openvla_successes": 2,
      "pi05_successes": 5,
      "difference_successes": 3,
      "openvla_success_rate": 0.4,
      "pi05_success_rate": 1.0,
      "difference_rate": 0.6
    }
  ],
  "pairs": [
    {
      "paired_key": "libero_goal:task-00:state-00",
      "suite": "libero_goal",
      "task_id": 0,
      "state_index": 0,
      "openvla": {
        "policy_id": "openvla-libero",
        "outcome": "success",
        "run_key": "v1:libero_goal:task-00:state-00:openvla-libero:fa5ae1e7509348889295bba8e08621d8b55e9baf:eb1ae763aea5977f0b6b52be912411277c59ac90c9c8158b5485e70e1376c32e",
        "artifact_ref": "episodes/libero_goal-task-00-state-00/attempt-b747390bf2a147b89d5dd30e3552679d",
        "manifest_sha256": "1ec4c2d4254a0339f684842618f06fcb4da490f5162fbad1f1167645459716ab"
      },
      "pi05": {
        "policy_id": "pi05-libero",
        "outcome": "success",
        "run_key": "v1:libero_goal:task-00:state-00:pi05-libero:11e0f560ebc9ca0f65d26241dd08e2ac07c22ee91455f1789afc2fc5c0378d7b:13bafd5d20562ec027e9d3c575b05ee5990ed7ec6def2a56964347ec18b9b037",
        "artifact_ref": "episodes/libero_goal-task-00-state-00/attempt-25fb39caae2f4218b5506db71196590f",
        "manifest_sha256": "1c1ccaed8e058d6338bf732f814f676c4bddd9186027fdd08b334071cee4b9af"
      }
    },
    {
      "paired_key": "libero_goal:task-00:state-01",
      "suite": "libero_goal",
      "task_id": 0,
      "state_index": 1,
      "openvla": {
        "policy_id": "openvla-libero",
        "outcome": "success",
        "run_key": "v1:libero_goal:task-00:state-01:openvla-libero:fa5ae1e7509348889295bba8e08621d8b55e9baf:eb1ae763aea5977f0b6b52be912411277c59ac90c9c8158b5485e70e1376c32e",
        "artifact_ref": "episodes/libero_goal-task-00-state-01/attempt-4363c2bdc3e24e998b68d2b753472fe0",
        "manifest_sha256": "f75359c1dc0b4ad6a6752785e53b407ff304e52441e9ddd4aed5f945783a2f4b"
      },
      "pi05": {
        "policy_id": "pi05-libero",
        "outcome": "success",
        "run_key": "v1:libero_goal:task-00:state-01:pi05-libero:11e0f560ebc9ca0f65d26241dd08e2ac07c22ee91455f1789afc2fc5c0378d7b:13bafd5d20562ec027e9d3c575b05ee5990ed7ec6def2a56964347ec18b9b037",
        "artifact_ref": "episodes/libero_goal-task-00-state-01/attempt-770a650b72ea49ef9c443f12c0996fbf",
        "manifest_sha256": "2385e71617a1668aabafcee05f45f29a5ed50cbb65b88eb76546ed5511f2d345"
      }
    },
    {
      "paired_key": "libero_goal:task-00:state-02",
      "suite": "libero_goal",
      "task_id": 0,
      "state_index": 2,
      "openvla": {
        "policy_id": "openvla-libero",
        "outcome": "timeout",
        "run_key": "v1:libero_goal:task-00:state-02:openvla-libero:fa5ae1e7509348889295bba8e08621d8b55e9baf:eb1ae763aea5977f0b6b52be912411277c59ac90c9c8158b5485e70e1376c32e",
        "artifact_ref": "episodes/libero_goal-task-00-state-02/attempt-4d396c15acd7481d84f50b51e2613d5a",
        "manifest_sha256": "ac15ca15cfd11149d72decc7ce0ce8793f47301f53688041fa116e4c45635bd5"
      },
      "pi05": {
        "policy_id": "pi05-libero",
        "outcome": "success",
        "run_key": "v1:libero_goal:task-00:state-02:pi05-libero:11e0f560ebc9ca0f65d26241dd08e2ac07c22ee91455f1789afc2fc5c0378d7b:13bafd5d20562ec027e9d3c575b05ee5990ed7ec6def2a56964347ec18b9b037",
        "artifact_ref": "episodes/libero_goal-task-00-state-02/attempt-a6cc7170f0eb4648a0ac56ae28000d25",
        "manifest_sha256": "03dbbb800594b227e4a6c8f342aeddeb876546a1c113659cbfbd6a1b300c94eb"
      }
    },
    {
      "paired_key": "libero_goal:task-00:state-03",
      "suite": "libero_goal",
      "task_id": 0,
      "state_index": 3,
      "openvla": {
        "policy_id": "openvla-libero",
        "outcome": "timeout",
        "run_key": "v1:libero_goal:task-00:state-03:openvla-libero:fa5ae1e7509348889295bba8e08621d8b55e9baf:eb1ae763aea5977f0b6b52be912411277c59ac90c9c8158b5485e70e1376c32e",
        "artifact_ref": "episodes/libero_goal-task-00-state-03/attempt-323040f29c7041f2baac05f49e45ff2f",
        "manifest_sha256": "c49127c26b8df47bf6eace1c8a737c020802c3fc7589c76444c2b527abe5168a"
      },
      "pi05": {
        "policy_id": "pi05-libero",
        "outcome": "success",
        "run_key": "v1:libero_goal:task-00:state-03:pi05-libero:11e0f560ebc9ca0f65d26241dd08e2ac07c22ee91455f1789afc2fc5c0378d7b:13bafd5d20562ec027e9d3c575b05ee5990ed7ec6def2a56964347ec18b9b037",
        "artifact_ref": "episodes/libero_goal-task-00-state-03/attempt-d82c9a6a57524603aa5661d6c8c6b4a1",
        "manifest_sha256": "e08f995589cc7e19357db8349810863af4590158c8eaaad76dd89c633fa92676"
      }
    },
    {
      "paired_key": "libero_goal:task-00:state-04",
      "suite": "libero_goal",
      "task_id": 0,
      "state_index": 4,
      "openvla": {
        "policy_id": "openvla-libero",
        "outcome": "timeout",